{
  "version": "1.0.0",
  "currency": "INR",
  "categories": [
    {
      "id": "world-plates",
      "label": "World Plates",
      "sort_order": 1
    },
    {
      "id": "rice-noodles",
      "label": "Rice & Noodles",
      "sort_order": 2
    },
    {
      "id": "breads",
      "label": "Indian Breads",
      "sort_order": 3
    },
    {
      "id": "mains",
      "label": "Mains",
      "sort_order": 4
    },
    {
      "id": "appetizers-veg",
      "label": "Veg Appetizers",
      "sort_order": 5
    },
    {
      "id": "appetizers-nonveg",
      "label": "Non-Veg Appetizers",
      "sort_order": 6
    },
    {
      "id": "beverages",
      "label": "Beverages",
      "sort_order": 7
    },
    {
      "id": "bar",
      "label": "Bar",
      "sort_order": 8
    }
  ],
  "items": [
    {
      "id": "1",
      "name": "Classic Mac and Cheese",
      "category": "world-plates",
      "description": "Creamy baked macaroni with rich cheese sauce.",
      "price": 265,
      "happy_hour_price": null,
      "is_veg": true,
      "spice_level": 0,
      "tags": [
        "Comfort"
      ],
      "rating": 4.4,
      "prep_time": "18 min",
      "is_available": true,
      "image_url": "https://images.unsplash.com/photo-1543339494-b4cd4f7ba686?auto=format&fit=crop&w=800&q=80",
      "is_alcoholic": false
    },
    {
      "id": "2",
      "name": "Jalapeno Pune Creamy Vegetable Pasta",
      "category": "world-plates",
      "description": "Penne tossed with roasted veggies in jalapeno cream.",
      "price": 290,
      "happy_hour_price": null,
      "is_veg": true,
      "spice_level": 2,
      "tags": [
        "Spicy"
      ],
      "rating": 4.3,
      "prep_time": "16 min",
      "is_available": true,
      "image_url": "https://images.unsplash.com/photo-1621996346565-e3dbc646d9a9?auto=format&fit=crop&w=800&q=80",
      "is_alcoholic": false
    },
    {
      "id": "3",
      "name": "Penne Alla Vodka",
      "category": "world-plates",
      "description": "Classic pink sauce pasta with a touch of vodka.",
      "price": 265,
      "happy_hour_price": null,
      "is_veg": true,
      "spice_level": 1,
      "tags": [
        "Bestseller"
      ],
      "rating": 4.6,
      "prep_time": "15 min",
      "is_available": true,
      "image_url": "https://images.unsplash.com/photo-1612874742237-652622197003?auto=format&fit=crop&w=800&q=80",
      "is_alcoholic": false
    },
    {
      "id": "4",
      "name": "Penne Alfredo",
      "category": "world-plates",
      "description": "Rich and creamy white sauce pasta with parmesan.",
      "price": 265,
      "happy_hour_price": null,
      "is_veg": true,
      "spice_level": 0,
      "tags": [
        "Classic"
      ],
      "rating": 4.5,
      "prep_time": "14 min",
      "is_available": true,
      "image_url": "https://images.unsplash.com/photo-1645112411341-6c4fd023714a?auto=format&fit=crop&w=800&q=80",
      "is_alcoholic": false
    },
    {
      "id": "5",
      "name": "Spaghetti AOP",
      "category": "world-plates",
      "description": "Al olio e peperoncino — garlic, oil, and chilli.",
      "price": 310,
      "happy_hour_price": null,
      "is_veg": true,
      "spice_level": 2,
      "tags": [
        "Simple"
      ],
      "rating": 4.3,
      "prep_time": "12 min",
      "is_available": true,
      "image_url": "https://images.unsplash.com/photo-1563379926898-05f4575a45d8?auto=format&fit=crop&w=800&q=80",
      "is_alcoholic": false
    },
    {
      "id": "6",
      "name": "Grilled Chicken",
      "category": "world-plates",
      "description": "Herb-marinated grilled chicken breast.",
      "price": 390,
      "happy_hour_price": null,
      "is_veg": false,
      "spice_level": 1,
      "tags": [
        "Healthy"
      ],
      "rating": 4.5,
      "prep_time": "20 min",
      "is_available": true,
      "image_url": "https://images.unsplash.com/photo-1532550907387-54ad4b060919?auto=format&fit=crop&w=800&q=80",
      "is_alcoholic": false
    },
    {
      "id": "7",
      "name": "Triple Veg Schezwan Fried Rice",
      "category": "rice-noodles",
      "description": "Three veggies wok-tossed in fiery schezwan sauce.",
      "price": 310,
      "happy_hour_price": null,
      "is_veg": true,
      "spice_level": 4,
      "tags": [
        "Hot"
      ],
      "rating": 4.4,
      "prep_time": "14 min",
      "is_available": true,
      "image_url": "https://images.unsplash.com/photo-1603133872878-684f208fb84b?auto=format&fit=crop&w=800&q=80",
      "is_alcoholic": false
    },
    {
      "id": "8",
      "name": "Veg Manchurian Fried Rice",
      "category": "rice-noodles",
      "description": "Fried rice loaded with Manchurian balls.",
      "price": 310,
      "happy_hour_price": null,
      "is_veg": true,
      "spice_level": 3,
      "tags": [
        "Popular"
      ],
      "rating": 4.5,
      "prep_time": "15 min",
      "is_available": true,
      "image_url": "https://images.unsplash.com/photo-1585937421612-70a008356fbe?auto=format&fit=crop&w=800&q=80",
      "is_alcoholic": false
    },
    {
      "id": "9",
      "name": "Tangra Chilli Chicken Egg Noodles",
      "category": "rice-noodles",
      "description": "Tangra-style chilli chicken with egg noodles.",
      "price": 399,
      "happy_hour_price": null,
      "is_veg": false,
      "spice_level": 4,
      "tags": [
        "Hot"
      ],
      "rating": 4.7,
      "prep_time": "16 min",
      "is_available": true,
      "image_url": "https://images.unsplash.com/photo-1585032226691-7593aa350485?auto=format&fit=crop&w=800&q=80",
      "is_alcoholic": false
    },
    {
      "id": "10",
      "name": "Triple Chicken Schezwan Fried Rice",
      "category": "rice-noodles",
      "description": "Three types of chicken in schezwan fried rice.",
      "price": 399,
      "happy_hour_price": null,
      "is_veg": false,
      "spice_level": 4,
      "tags": [
        "Bestseller"
      ],
      "rating": 4.8,
      "prep_time": "16 min",
      "is_available": true,
      "image_url": "https://images.unsplash.com/photo-1603133872878-684f208fb84b?auto=format&fit=crop&w=800&q=80",
      "is_alcoholic": false
    },
    {
      "id": "11",
      "name": "Roti",
      "category": "breads",
      "description": "Whole wheat roti from the tandoor.",
      "price": 30,
      "happy_hour_price": null,
      "is_veg": true,
      "spice_level": 0,
      "tags": [
        "Add-on"
      ],
      "rating": 4.2,
      "prep_time": "5 min",
      "is_available": true,
      "image_url": "https://images.unsplash.com/photo-1601050690597-df0568f70950?auto=format&fit=crop&w=800&q=80",
      "is_alcoholic": false
    },
    {
      "id": "12",
      "name": "Butter Roti",
      "category": "breads",
      "description": "Soft roti slathered with butter.",
      "price": 40,
      "happy_hour_price": null,
      "is_veg": true,
      "spice_level": 0,
      "tags": [
        "Add-on"
      ],
      "rating": 4.3,
      "prep_time": "5 min",
      "is_available": true,
      "image_url": "https://images.unsplash.com/photo-1601050690597-df0568f70950?auto=format&fit=crop&w=800&q=80",
      "is_alcoholic": false
    },
    {
      "id": "13",
      "name": "Naan",
      "category": "breads",
      "description": "Classic tandoori naan bread.",
      "price": 40,
      "happy_hour_price": null,
      "is_veg": true,
      "spice_level": 0,
      "tags": [
        "Add-on"
      ],
      "rating": 4.3,
      "prep_time": "6 min",
      "is_available": true,
      "image_url": "https://images.unsplash.com/photo-1626082927389-6cd097cdc6ec?auto=format&fit=crop&w=800&q=80",
      "is_alcoholic": false
    },
    {
      "id": "14",
      "name": "Butter Naan",
      "category": "breads",
      "description": "Fresh naan brushed with melted butter.",
      "price": 45,
      "happy_hour_price": null,
      "is_veg": true,
      "spice_level": 0,
      "tags": [
        "Add-on"
      ],
      "rating": 4.4,
      "prep_time": "6 min",
      "is_available": true,
      "image_url": "https://images.unsplash.com/photo-1626082927389-6cd097cdc6ec?auto=format&fit=crop&w=800&q=80",
      "is_alcoholic": false
    },
    {
      "id": "15",
      "name": "Butter Laccha Naan",
      "category": "breads",
      "description": "Layered flaky naan with butter.",
      "price": 65,
      "happy_hour_price": null,
      "is_veg": true,
      "spice_level": 0,
      "tags": [
        "Premium"
      ],
      "rating": 4.5,
      "prep_time": "7 min",
      "is_available": true,
      "image_url": "https://images.unsplash.com/photo-1565557623262-b51c2513a641?auto=format&fit=crop&w=800&q=80",
      "is_alcoholic": false
    },
    {
      "id": "16",
      "name": "Butter Garlic Naan",
      "category": "breads",
      "description": "Naan infused with garlic butter from the tandoor.",
      "price": 65,
      "happy_hour_price": null,
      "is_veg": true,
      "spice_level": 0,
      "tags": [
        "Popular"
      ],
      "rating": 4.6,
      "prep_time": "7 min",
      "is_available": true,
      "image_url": "https://images.unsplash.com/photo-1626082927389-6cd097cdc6ec?auto=format&fit=crop&w=800&q=80",
      "is_alcoholic": false
    },
    {
      "id": "17",
      "name": "Warqi Paratha",
      "category": "breads",
      "description": "Multi-layered flaky paratha.",
      "price": 99,
      "happy_hour_price": null,
      "is_veg": true,
      "spice_level": 0,
      "tags": [
        "Premium"
      ],
      "rating": 4.5,
      "prep_time": "8 min",
      "is_available": true,
      "image_url": "https://images.unsplash.com/photo-1565557623262-b51c2513a641?auto=format&fit=crop&w=800&q=80",
      "is_alcoholic": false
    },
    {
      "id": "18",
      "name": "Cheese Chilli Garlic Naan",
      "category": "breads",
      "description": "Naan stuffed with cheese, chilli, and garlic.",
      "price": 210,
      "happy_hour_price": null,
      "is_veg": true,
      "spice_level": 2,